{"terminal_decision":"continue","stage":"scientific_pilot","executor_prompt":"codex/prompts/01_scientific_pilot.md","task_instruction":"Start the scientific pilot gate now that infrastructure is passed. Run the bounded pilot on the small English-trained causal LM with the minimum real conditions: structured Portuguese, token-shuffled Portuguese, and matched English, plus the known-good Portuguese baseline or constructed sanity checks for the grammar probe. Use full-parameter continued pretraining, fixed data splits and hashes, fixed evaluation across all saved pilot checkpoints, and one common predeclared sampler configuration for early/middle/late LLC traces. Preserve manifests/logs/status/final exit codes and update state/current_status.json, state/decision_log.md, state/experiment_registry.csv, and a pilot phase report. Success criterion: Portuguese validation improves, grammar probe is above chance or sanity checks pass, structured vs shuffled Portuguese are behaviorally distinguishable in the pilot, early/middle/late sampler traces are interpretable under the same sampler config, and the gate decision is explicitly recorded as proceed, pivot, or fail with evidence paths.","time_budget_hours":1.25,"expected_cost_usd":1.25,"rationale":"Infrastructure gate completed successfully with strong VRAM headroom and project cost estimates well under the unattended hard cap. The next required gate is the scientific pilot; final training must not start until the pilot demonstrates the behavioral and sampler prerequisites. With 7.876 hours remaining and only $0.0919 spent, a 1.25 hour bounded pilot is the right next action and leaves enough time for diagnosis, final training, LLC, and reporting if the gate passes."}