{"terminal_decision":"continue","stage":"infrastructure_gate","executor_prompt":"codex/prompts/00_infrastructure_gate.md","task_instruction":"Run the infrastructure gate fresh on the now-GPU-accessible VM. Verify CUDA visibility, record GPU model and peak VRAM/headroom, run the complete train-save-reload-evaluate-sample loop on TinyStories-3M, and use infra/remote/run_bounded_job.sh for any job over five minutes. Preserve manifests, logs, status files, final exit codes, and the current git commit. Update state/current_status.json, state/decision_log.md, and state/experiment_registry.csv with evidence, uncertainty, runtime, cost projection, gate decision, and next bounded action. Success criterion: infrastructure gate is passed/ready_for_pilot with at least 25% VRAM headroom and no reliance on prior failed CUDA history.","time_budget_hours":1.25,"expected_cost_usd":1.25,"rationale":"The live state explicitly says the previous CUDA/device-access failures are resolved, torch.cuda.is_available() is true on the NVIDIA L4, and the gate is ready_to_retry. With 8 hours remaining, $0.05 spent, and no last executor failure in this run, the correct next step is the actual infrastructure gate rather than diagnosis or escalation. The requested budget is bounded and well below the hard cap."}