{"terminal_decision":"continue","stage":"llc_campaign","executor_prompt":"codex/prompts/03_llc_campaign.md","task_instruction":"Run the LLC campaign for final run `final_training_20260620T053855Z` using the frozen behavior-only checkpoint selection in `results/02_final_training/final_training_20260620T053855Z/llc_checkpoint_selection.json` with selected tokens `[0, 100000, 400000, 1500000, 5000000, 8000000]`. Use one globally selected sampler configuration, fixed reference set/loss/sequence length/normalization, and preserve chain-level traces, running estimates, sampler settings, and failures under `results/03_llc_campaign/<run_id>/`. Launch GPU work through `infra/remote/run_bounded_job.sh`. Success criterion: reportable LLC diagnostics exist for the frozen subset, checkpoint selection is unchanged, and `state/current_status.json`, `state/decision_log.md`, and `state/experiment_registry.csv` are updated with a gate decision and next bounded action.","time_budget_hours":5.5,"expected_cost_usd":5.5,"rationale":"Infrastructure, pilot, and final behavioral gates have passed, and the last executor froze LLC checkpoints without inspecting final LLC. The next ordered stage is therefore the LLC campaign. With 7.47h remaining and only $0.25 spent, a 5.5h bounded LLC run is within the hard cap and still leaves time for a report or diagnosis tick."}