{
  "terminal_decision": "continue",
  "stage": "final_training",
  "executor_prompt": "codex/prompts/02_final_training.md",
  "task_instruction": "Proceed from the passed TinyStories-3M pilot gate to the TinyStories-8M final full-parameter continued-pretraining run. Before launch, verify the committed state records passed infrastructure and pilot gates, immutable split manifests/hashes are available, cached model/data/tokenizer dependencies are usable without internet, and the manifest records the current git commit. Launch only through `infra/remote/run_bounded_job.sh` with a bounded runtime, status/log/exit-code artifacts, and no cloud lifecycle actions. Run the minimum real final trajectories: structured Portuguese seed 1, structured Portuguese seed 2, token-shuffled Portuguese, and matched English, with behavioral BPB/grammar evaluation at every saved checkpoint and checkpoint hashes recorded. Success criterion: a restartable `results/02_final_training/<run_id>/` contains manifests, logs, exit codes, checkpoint hashes, per-checkpoint behavioral metrics for all required conditions, updated `state/current_status.json`, `state/decision_log.md`, `state/experiment_registry.csv`, and a committed gate decision identifying the checkpoint subset for LLC.",
  "time_budget_hours": 6,
  "expected_cost_usd": 4.5,
  "rationale": "Infrastructure and scientific pilot gates are passed with a structured proceed decision, so the gate order allows final training and no diagnose tick is needed. The pilot projects median charged runtime at 3.5271 hours and cost at $3.5271, with a high estimate around 7.0543; granting 6 hours gives useful slack while preserving some deadline margin if the run lands near the median. Cumulative spend is only $0.1044, so an expected $4.5 increment stays well below the $35 soft cap and $50 hard cap under the standing unattended authorization."
}