{"terminal_decision":"continue","stage":"final_training","executor_prompt":"codex/prompts/02_final_training.md","task_instruction":"Run the greenlit scale-up final_training using the FROZEN verified recipe from state/current_status.json: TinyStories-8M, full-parameter FP32 AdamW continued pretraining, lr 1e-4, 3% warmup, cosine decay, grad clip 1.0, weight_decay 0.01, batch 64, Wikipedia-PT corpus. Commit any required run/config state before launch, then run the long GPU job via infra/remote/run_bounded_job.sh with a bounded runtime. Train/evaluate the four priority conditions in order: structured Portuguese seed A, token-shuffled Portuguese, matched English, structured Portuguese seed B, targeting about 100,000,000 tokens per condition with dense log-spaced checkpoints (at least 15) and a fixed larger Portuguese validation set (at least 500 examples). Success criterion: a restartable final_training run under results/02_final_training/<run_id>/ with manifests/logs/status/final exit code, checkpoint hashes, package/hardware/precision/optimizer/data/tokenizer metadata, and updated state/current_status.json, state/decision_log.md, and state/experiment_registry.csv. Structured-PT validation BPB must decrease during training and beat the shuffled control. If structured PT degrades, English degrades with no Portuguese gain, or the scale-up contradicts the verified pilot, stop, preserve diagnostics, and return failed/blocked with gate_decision:pivot rather than reporting a null result.","time_budget_hours":6,"expected_cost_usd":18,"rationale":"AGENTS.md and docs/00_EXECUTIVE_PLAN.md require infrastructure and scientific gates before the final campaign, and the live state records those prerequisites plus explicit operator greenlight for scale-up with requires_human_approval=false. Therefore escalation is not needed for spend or scope, and the next useful bounded action is final_training. There are 8 hours remaining and only $0.8729 accrued against an $80 hard cap, so a 6-hour grant is appropriate for the scaled run while leaving time for LLC/report or diagnosis if training completes early. The directive explicitly preserves the scientific validity gate: a non-learning structured-Portuguese trajectory is a pipeline failure, not a completed null result."}