{"terminal_decision":"complete","stage":"report","executor_prompt":"codex/prompts/04_report.md","task_instruction":"No executor action requested. The gate sequence has reached a validated report package from the real final-training and LLC batch16 artifacts; halt the unattended run so the harness can fetch results and request VM stop.","time_budget_hours":0,"expected_cost_usd":0,"rationale":"Infrastructure, scientific pilot, final training, LLC campaign, and report phases have all reached recorded terminal gate decisions. The latest report package passed validation with 225 verified table cells, mock_reference_count=0, preserved the token-0 LLC rejection, and avoided prohibited claims. State files identify the next action as operator review or submission packaging with no additional GPU work required. Cumulative cost is about $0.85, well below the $50 hard cap, and further unattended work would not materially improve the report without expanding scope beyond the completed report-with-limitations result."}