{"terminal_decision":"escalate","stage":"recipe_search","executor_prompt":"codex/prompts/recipe_search.md","task_instruction":"Halt for operator greenlight before any larger continuation. Present the verified winning recipe and checkpoint: TinyStories-8M full-parameter FP32 AdamW, lr 1e-4, 3% warmup, cosine decay, grad clip 1.0, weight decay 0.01, batch 64, 1,007,616 tokens, checkpoint at results/recipe_search/recipe_search_20260620T171838Z_lr1e-4_wiki1m/conditions/structured_pt/checkpoints/tokens_001000000. Success criterion for resuming: operator explicitly authorizes the longer continue-from-checkpoint run or changes scope.","time_budget_hours":0,"expected_cost_usd":0,"rationale":"Recipe search achieved its required deliverable: structured Portuguese BPB decreased from 6.773542 to 3.806601 and beat the shuffled control final BPB by 0.407478. The live state and sequencing rules require stopping after a verified recipe because this phase must not launch a long or scaled continuation without operator greenlight. This is not a spend-approval escalation; it is the predeclared scientific/operational handoff after recipe_search. Remaining time is about 1.34h, cumulative cost is only $0.8729, and no further bounded recipe-search action is useful before the required human decision."}