{"terminal_decision":"continue","stage":"recipe_search","executor_prompt":"codex/prompts/recipe_search.md","task_instruction":"Run the next short recipe_search autoresearch attempt on TinyStories-8M. Use a bounded 10-15 minute training/evaluation attempt, changing the recipe from any prior failed/degraded runs based on the logged diagnostics rather than repeating it. Success criterion: produce a checkpoint plus evidence that structured-Portuguese validation BPB decreases over training and finishes better than the token-shuffled Portuguese control; update state/current_status.json, state/decision_log.md, and state/experiment_registry.csv. If that verified recipe is found, return gate_decision: proceed and do not start any scale-up or long run. If the attempt fails to learn, preserve diagnostics and return the next hypothesis for a changed short attempt.","time_budget_hours":0.25,"expected_cost_usd":1.5,"rationale":"The live state says the infrastructure gate is already passed and the current phase is recipe_search, with only 1.5 hours remaining. Sequencing rules require many short recipe attempts and explicitly forbid long scaled training from recipe_search. There is no last executor failure on this tick, so the correct next action is a short bounded recipe_search attempt aimed at demonstrating real structured-Portuguese learning before any operator greenlight."}